Position,Company,Location,Tags,URL
Customer Experience Associate,Koala Health,Remote,"technical, support, web, voice, medical, health, healthcare",https://remoteOK.com/remote-jobs/remote-customer-experience-associate-koala-health-1093780
Human Resources Associate Mid level,CoinGecko,,"cryptocurrency, hr, system, training, technical, support, payroll, financial, education, leader, management, operations, operational",https://remoteOK.com/remote-jobs/remote-human-resources-associate-mid-level-coingecko-1093779
Backend Software Engineer,Prophet Security,,"golang, infosec, software, security, engineer, backend",https://remoteOK.com/remote-jobs/remote-backend-software-engineer-prophet-security-1093777
Senior Software Engineer,lakeFS,,"golang, software, senior, engineer",https://remoteOK.com/remote-jobs/remote-senior-software-engineer-lakefs-1093776
Product Engineer,Tolt,,"javascript, typescript, react, product, aws, engineer",https://remoteOK.com/remote-jobs/remote-product-engineer-tolt-1093775
Connected Care Assistant,Included Health,Remote,"assistant, training, recruiter, support, management, medical, health, healthcare, full-time, non tech",https://remoteOK.com/remote-jobs/remote-connected-care-assistant-included-health-1093774
Customer Care Advisor,GoodLeap,Remote,"supervisor, support, developer, software, management, sales, reliability, digital nomad",https://remoteOK.com/remote-jobs/remote-customer-care-advisor-goodleap-1093771
Senior Backend Engineer,Monzo,,"golang, senior, engineer, backend",https://remoteOK.com/remote-jobs/remote-senior-backend-engineer-monzo-1093770
$2.000+ monthly LinkedIn DM reply Job USA TIMEZONE,Executive Bootcamp,,"sales, marketing, other",https://remoteOK.com/remote-jobs/remote-2-000-monthly-linkedin-dm-reply-job-usa-timezone-executive-bootcamp-1093768
DevOps Engineer,InfStones,Texas,"amazon, web3, system, security, support, software, testing, test, code, qa, devops, serverless, cloud, git, node, administrator, management, reliability, engineer, linux, full-time",https://remoteOK.com/remote-jobs/remote-devops-engineer-infstones-1093766
Technical Writer,Peach Finance,Remote,"system, training, technical, writer, developer, financial, video, finance, api, management, content, senior, marketing, digital nomad",https://remoteOK.com/remote-jobs/remote-technical-writer-peach-finance-1093765
Senior Full Stack Engineer,FetLife,,"engineer, ruby, vue, redis, rust, kubernetes, work from home, remote, terraform, google cloud, senior, dev, javascript, backend, front end, full time, full stack, sql, postgres, elasticsearch, typescript",https://remoteOK.com/remote-jobs/remote-senior-full-stack-engineer-fetlife-1093764
Customer Support Engineer I Intern,CloudWalk,Remote,"technical, support, voice, fintech, ruby, engineer, engineering",https://remoteOK.com/remote-jobs/remote-customer-support-engineer-i-intern-cloudwalk-1093763
Account Executive,CoinGecko,,"saas, web3, cryptocurrency, training, technical, support, growth, financial, education, fintech, api, leader, strategy, management, senior, operations, operational, marketing, sales, executive",https://remoteOK.com/remote-jobs/remote-account-executive-coingecko-1093761
,,Remote,,https://remoteOK.com/remote-jobs/remote-1093760
Medical Record Specialist,Accompany Health,United States,"education, lead, go, medical, health, healthcare, full-time, non tech",https://remoteOK.com/remote-jobs/remote-medical-record-specialist-accompany-health-1093756
Blockchain Security Expert AI Track,CertiK,US / Remote,"security, web3, support, software, sales, engineering, full-time",https://remoteOK.com/remote-jobs/remote-blockchain-security-expert-ai-track-certik-1093753
Growth Marketing Lead,Anchorage Digital,United States,"growth, crypto, security, testing, financial, finance, bank, leader, management, lead, marketing, analytics, legal, engineering",https://remoteOK.com/remote-jobs/remote-growth-marketing-lead-anchorage-digital-1093752
Senior Backend Engineer,Mozilla Corporation,,"golang, senior, engineer, backend",https://remoteOK.com/remote-jobs/remote-senior-backend-engineer-mozilla-corporation-1093751
Data Engineer,Nomi Health,"Austin, Texas","technical, testing, nosql, medical, engineer, engineering",https://remoteOK.com/remote-jobs/remote-data-engineer-nomi-health-1093750
Associate Director Clinical Monitoring,WEP Clinical ,"Remote, US","director, training, support, growth, travel, management, lead, senior",https://remoteOK.com/remote-jobs/remote-associate-director-clinical-monitoring-wep-clinical-1093749
Social Programs Manager,One Medical,"Houston, TX",manager,https://remoteOK.com/remote-jobs/remote-social-programs-manager-one-medical-1093747
Chargeback Analyst,CloudWalk,São Paulo,"analyst, teach, support, code, fintech, operations, operational, engineering",https://remoteOK.com/remote-jobs/remote-chargeback-analyst-cloudwalk-1093746
Principal Software Engineer,CEF.Ai,,"other, dev",https://remoteOK.com/remote-jobs/remote-principal-software-engineer-cef-ai-1093744
,,,,https://remoteOK.com/remote-jobs/remote-1093743
Korean Japanese Lyric Transliteration Reviewer,Welo Data,,"quality assurance, teaching, part time, remote, freelance, japanese, korean, reviewer, translation",https://remoteOK.com/remote-jobs/remote-korean-japanese-lyric-transliteration-reviewer-welo-data-1093742
Staff Software Engineer Backend,Socure,Carson City,"software, design, graphql, system, support, fintech, elasticsearch, lead, analytics, engineer, engineering, apache, backend, digital nomad",https://remoteOK.com/remote-jobs/remote-staff-software-engineer-backend-socure-1093740
Senior DevOps Engineer,Inkitt,Remote Mexico City,"redis, system, security, support, devops, elasticsearch, c, cloud, postgresql, senior, analytics, reliability, engineer, backend",https://remoteOK.com/remote-jobs/remote-senior-devops-engineer-inkitt-1093739
Software engineer,Sticker Mule,,"engineer, dev, postgres, docker, redis, kubernetes, gcp",https://remoteOK.com/remote-jobs/remote-software-engineer-sticker-mule-1093738
KYC Ops Leader,Coins.ph,"Taguig City, Metro Manila, Philippines","crypto, cryptocurrencies, training, growth, financial, fintech, mobile, leader, strategy, management, lead, operations, operational",https://remoteOK.com/remote-jobs/remote-kyc-ops-leader-coins-ph-1093737
Senior Android Engineer,Tala,Remote-India,"crypto, financial, fintech, management, senior, android, engineer",https://remoteOK.com/remote-jobs/remote-senior-android-engineer-tala-1093735
Aprio Canada National Tax Office Leader Senior Tax Director,Aprio,Toronto,"director, training, technical, support, growth, leader, management, lead, senior, executive",https://remoteOK.com/remote-jobs/remote-aprio-canada-national-tax-office-leader-senior-tax-director-aprio-1093729
Associate Data Engineer,Sayari,United States,"python, training, software, growth, financial, cloud, engineer, engineering, apache",https://remoteOK.com/remote-jobs/remote-associate-data-engineer-sayari-1093725
Paid Media Data Analyst,CloudWalk,Brasilia,"analyst, technical, growth, financial, investment, fintech, strategy, marketing, analytics, engineering, executive",https://remoteOK.com/remote-jobs/remote-paid-media-data-analyst-cloudwalk-1093722
Senior Software Engineer Backend,Allocate,California,"software, design, c#, docker, technical, support, developer, code, web, fintech, git, api, strategy, senior, engineer, engineering, backend, digital nomad",https://remoteOK.com/remote-jobs/remote-senior-software-engineer-backend-allocate-1093713
Web Developer,MailerLite,,"front end, dev",https://remoteOK.com/remote-jobs/remote-web-developer-mailerlite-1093712
Account Strategist,Smartbug Media,"Remote, United States","strategist, support, growth, director, voice, strategy, management, lead, content, senior, operations, marketing, sales, health, recruiting, e-commerce",https://remoteOK.com/remote-jobs/remote-account-strategist-smartbug-media-1093708
Associate Customer Success Manager,COMPLY,United States,"manager, salesforce, consulting, technical, support, software, growth, financial, investment, leader, management, health",https://remoteOK.com/remote-jobs/remote-associate-customer-success-manager-comply-1093707
Account Executive Enterprise,Panopto,Remote - US,"saas, technical, recruiter, support, manager, video, leader, management, senior, sales, health, recruitment, executive",https://remoteOK.com/remote-jobs/remote-account-executive-enterprise-panopto-1093706
Sales Development Representative,Harkla,,sales,https://remoteOK.com/remote-jobs/remote-sales-development-representative-harkla-1093704
Senior Front End Engineer,AscendEX,,"design, cryptocurrency, front-end, back-end, software, growth, code, web, financial, management, senior, junior, engineer, engineering, digital nomad",https://remoteOK.com/remote-jobs/remote-senior-front-end-engineer-ascendex-1093703
Business Data Analyst,Coin Market Cap Ltd,,"analyst, crypto, support, growth, web, financial, mobile, operational, analytics",https://remoteOK.com/remote-jobs/remote-business-data-analyst-coin-market-cap-ltd-1093701
Infrastructure,Backpack ,,"security, developer, cloud, engineering, digital nomad",https://remoteOK.com/remote-jobs/remote-infrastructure-backpack-1093700
Software Engineer Data Infrastructure & Acquisition,Speechify,,dev,https://remoteOK.com/remote-jobs/remote-software-engineer-data-infrastructure-acquisition-speechify-1093699
Software Engineer II Full Stack,Greenlight Financial Technology,Atlanta (Remote Friendly),"software, design, technical, recruiter, support, web, finance, financial, fintech, banking, mobile, senior, reliability, health, engineer, engineering, backend, digital nomad",https://remoteOK.com/remote-jobs/remote-software-engineer-ii-full-stack-greenlight-financial-technology-1093698
Associate Creative Director,Right Side Up,"Austin, TX","director, design, financial, lead, junior, marketing, digital nomad",https://remoteOK.com/remote-jobs/remote-associate-creative-director-right-side-up-1093697
Revenue Operations Manager,AFAR,"New York, NY","manager, design, support, growth, travel, finance, strategy, management, lead, operations, marketing, sales, digital nomad",https://remoteOK.com/remote-jobs/remote-revenue-operations-manager-afar-1093696
Fullstack Golang Engineer,Discern,,"golang, software, golang, engineer, fullstack",https://remoteOK.com/remote-jobs/remote-fullstack-golang-engineer-discern-1093694
C C++ Linux developer,Tempesta Technologies,,"linux, c plus plus, c, databases, algorithms, data structures",https://remoteOK.com/remote-jobs/remote-c-c-linux-developer-tempesta-technologies-1093692
Content led Marketer,Melapress,,"marketing, content writing, copywriting",https://remoteOK.com/remote-jobs/remote-content-led-marketer-melapress-1093691
WordPress Plugins & Themes developer,Melapress,,"dev, devops, wordpress, php, javascript, full time, ecommerce, api, english",https://remoteOK.com/remote-jobs/remote-wordpress-plugins-themes-developer-melapress-1093690
Marketing Lead,The Block,Remote within United States,"web3, crypto, cryptocurrency, salesforce, support, growth, controller, voice, financial, strategy, lead, content, operations, marketing, legal, sales",https://remoteOK.com/remote-jobs/remote-marketing-lead-the-block-1093689
Intelligence &amp; Research Analyst,Clipbook,,"analyst, support, strategy, lead",https://remoteOK.com/remote-jobs/remote-intelligence-amp-research-analyst-clipbook-1093688
Government Relations Officer,Injective Labs,,"defi, crypto, technical, growth, financial, finance, leader, strategy, lead, operations, legal, educational, executive",https://remoteOK.com/remote-jobs/remote-government-relations-officer-injective-labs-1093686
Software Engineer II Full Stack,Greenlight Financial Technology,Atlanta (Remote Friendly),"software, design, technical, recruiter, support, web, finance, financial, fintech, banking, mobile, senior, reliability, health, engineer, engineering, backend, digital nomad",https://remoteOK.com/remote-jobs/remote-software-engineer-ii-full-stack-greenlight-financial-technology-1093682
UI UX Product Designer,Crewvision,,design,https://remoteOK.com/remote-jobs/remote-ui-ux-product-designer-crewvision-1093681
Admin and Support Specialist With Love for Writing,Interaction Design Foundation,,"content writing, customer support, writing",https://remoteOK.com/remote-jobs/remote-admin-and-support-specialist-with-love-for-writing-interaction-design-foundation-1093680
Crypto Compliance Project Manager,dLocal,,"crypto, manager, cryptocurrency, support, financial, fintech, content, go, health, non tech",https://remoteOK.com/remote-jobs/remote-crypto-compliance-project-manager-dlocal-1093679
Head of CRM,OANDA Europe Ltd.,London,"cryptocurrencies, support, software, growth, financial, strategy, management, lead, marketing, analytics, recruitment",https://remoteOK.com/remote-jobs/remote-head-of-crm-oanda-europe-ltd-1093678
Content Producer Technical Content Engineer Junior Dev,Private.Ki,,"other, dev, writer, writing, marketing",https://remoteOK.com/remote-jobs/remote-content-producer-technical-content-engineer-junior-dev-private-ki-1093677
Executive Assistant &amp; Office Manager,Sword Health,Lisboa,"manager, assistant, support, growth, travel, financial, management, sales, medical, health, executive",https://remoteOK.com/remote-jobs/remote-executive-assistant-amp-office-manager-sword-health-1093673
Account Executive Retail,Quantum Metric,United States,"saas, training, support, devops, financial, education, leader, android, sales, recruitment, executive, ecommerce",https://remoteOK.com/remote-jobs/remote-account-executive-retail-quantum-metric-1093672
Senior Product Designer,AllTrails,Remote,"design, ios, training, designer, testing, growth, web, lead, senior, marketing, engineering, digital nomad",https://remoteOK.com/remote-jobs/remote-senior-product-designer-alltrails-1093671
Data Collection Participant Photo Submission Task,CrowdGen by Appen,Any,"training, manager",https://remoteOK.com/remote-jobs/remote-data-collection-participant-photo-submission-task-crowdgen-by-appen-1093670
Aprio PH FP&amp;A Analyst,Aprio,"Clark, Pampanga","analyst, testing, growth, financial, finance, microsoft, management, senior, executive, full-time",https://remoteOK.com/remote-jobs/remote-aprio-ph-fpampa-analyst-aprio-1093669
Sales Development Representative,Heard,Remote,"saas, consult, growth, voice, lead, excel, sales, health",https://remoteOK.com/remote-jobs/remote-sales-development-representative-heard-1093666
Underwriter,Gravie,Remote,"design, training, technical, support, growth, financial, education, strategy, management, sales, health, healthcare, digital nomad",https://remoteOK.com/remote-jobs/remote-underwriter-gravie-1093665
Full Stack Engineer,Sensor Tower,Istanbul,"jira, c#, developer, code, bank, analytics, health, engineer, recruitment, linux, full-time, digital nomad",https://remoteOK.com/remote-jobs/remote-full-stack-engineer-sensor-tower-1093661
Senior AI Python Developer,Koombea,,"python, developer, software, api, senior, engineering, backend, digital nomad",https://remoteOK.com/remote-jobs/remote-senior-ai-python-developer-koombea-1093660
User Support Specialist,Slate,Remote,"technical, support, lead, content, engineering",https://remoteOK.com/remote-jobs/remote-user-support-specialist-slate-1093659
Senior Software Engineer,Proof,"Remote, Boston, MA Preferred","software, design, front-end, back-end, security, technical, support, growth, code, web, manager, cloud, ruby, rails, management, lead, senior, legal, go, engineer, engineering, digital nomad",https://remoteOK.com/remote-jobs/remote-senior-software-engineer-proof-1093658
ML Scientist Foundation Model,Egen,"Remote, Central US","design, training, technical, support, cloud, legal, health, engineering, digital nomad",https://remoteOK.com/remote-jobs/remote-ml-scientist-foundation-model-egen-1093656
Exchange Operations Analyst,Coins.ph,"Singapore, Singapore","analyst, crypto, cryptocurrencies, system, test, growth, financial, bank, admin, mobile, management, operations",https://remoteOK.com/remote-jobs/remote-exchange-operations-analyst-coins-ph-1093648
Customer Success Analyst,Voxy Inc,São Paulo,"analyst, hr, students, training, consulting, technical, education, leader, management, health",https://remoteOK.com/remote-jobs/remote-customer-success-analyst-voxy-inc-1093647
QA Analyst,City IT,Any US State,"analyst, system, support, software, testing, test, scrum, qa, management, go",https://remoteOK.com/remote-jobs/remote-qa-analyst-city-it-1093646
Investment Research Associate,Seaport Global Holdings LLC,Flexible,"accounting, investment, finance, senior, excel, non tech",https://remoteOK.com/remote-jobs/remote-investment-research-associate-seaport-global-holdings-llc-1093645
Technical Account Manager,HONK,Remote,"manager, design, saas, training, consulting, technical, support, operations, sales, engineering, digital nomad",https://remoteOK.com/remote-jobs/remote-technical-account-manager-honk-1093644
Sales Director,The Block,Remote within United States,"director, crypto, cryptocurrency, ceo, support, growth, voice, financial, video, lead, senior, operations, sales, executive",https://remoteOK.com/remote-jobs/remote-sales-director-the-block-1093643
Developer Relations Engineer,MachineFi Lab,US Remote,"developer, design, web3, crypto, cryptocurrency, technical, growth, code, travel, api, leader, marketing, engineer, engineering, digital nomad",https://remoteOK.com/remote-jobs/remote-developer-relations-engineer-machinefi-lab-1093641
Assistant Trader,Exora,,"finance, sales, crypto, junior",https://remoteOK.com/remote-jobs/remote-assistant-trader-exora-1093629
Senior DevOps Engineer,Prompt,,"design, system, security, docker, developer, software, devops, investment, cloud, management, senior, reliability, healthcare, engineer, digital nomad",https://remoteOK.com/remote-jobs/remote-senior-devops-engineer-prompt-1093626
Senior Security Engineer,Loft Orbital Solutions,,"security, design, software, growth, code, financial, senior, operations, health, healthcare, engineer, engineering, digital nomad",https://remoteOK.com/remote-jobs/remote-senior-security-engineer-loft-orbital-solutions-1093625
Senior DevOps Engineer,FetLife,,"engineer, sys admin, ops, ruby, devops, postgres, elasticsearch, docker, redis, rust, kubernetes, google cloud, site reliability engineer",https://remoteOK.com/remote-jobs/remote-senior-devops-engineer-fetlife-1093624
Manufacturing Experts AI Trainer,RYZ Labs,Remote-,"trainer, cloud",https://remoteOK.com/remote-jobs/remote-manufacturing-experts-ai-trainer-ryz-labs-1093623
Primary Coach Career Prep,Management Leadership For Tomorrow,Remote,"salesforce, students, consulting, founder, support, growth, travel, financial, leader, exec, management, content, legal, health, recruitment, internship, full-time, part-time",https://remoteOK.com/remote-jobs/remote-primary-coach-career-prep-management-leadership-for-tomorrow-1093622
Membership Support & Content Coordinator,Jtine Co,,"backend, customer support, wordpress, WooCommerce, Email Systems, membership sites, active campaign",https://remoteOK.com/remote-jobs/remote-membership-support-content-coordinator-jtine-co-1093621
Blockchain Security Researcher,Tenderly,Europe OR In-Office Belgrade,"security, web3, ethereum, full-stack, support, testing, growth, serverless, cloud, node, golang",https://remoteOK.com/remote-jobs/remote-blockchain-security-researcher-tenderly-1093620
$30 Hourly Virtual Assistant USA RESIDENTS ONLY,HOLDON NOW,,"admin, customer support, data entry, Customer Service",https://remoteOK.com/remote-jobs/remote-30-hourly-virtual-assistant-usa-residents-only-holdon-now-1093611
Backend Developer @ lobstr.io Python Scraping Celery,lobstr.io,,"dev, python, backend, redis, remote, api, tech lead, docker, cybersecurity, architecture",https://remoteOK.com/remote-jobs/remote-backend-developer-lobstr-io-python-scraping-celery-lobstr-io-1093607
Chief Executive Officer Crypto Blockchain,Caiz,,"crypto, cryptocurrency, system, security, ceo, support, voice, financial, investor, finance, fintech, leader, strategy, lead, senior, legal, executive",https://remoteOK.com/remote-jobs/remote-chief-executive-officer-crypto-blockchain-caiz-1093606
Senior Mobile iOS Engineer,Yassir,,"ios, design, redis, frontend, back-end, technical, code, web, financial, fintech, cloud, mobile, senior, go, engineer, engineering, digital nomad",https://remoteOK.com/remote-jobs/remote-senior-mobile-ios-engineer-yassir-1093598
Member of Technical Staff Transparency,Anchorage Digital,United States,"design, crypto, front-end, back-end, security, technical, support, software, test, growth, code, financial, finance, bank, legal, engineering, digital nomad",https://remoteOK.com/remote-jobs/remote-member-of-technical-staff-transparency-anchorage-digital-1093596
Security Researcher,Spearbit,,"security, defi, ethereum, technical, senior",https://remoteOK.com/remote-jobs/remote-security-researcher-spearbit-1093595
AI Driven Engineer Ruby,CloudWalk,São Paulo,"technical, software, test, growth, code, financial, fintech, banking, bank, ruby, rails, management, marketing, engineer, engineering, backend",https://remoteOK.com/remote-jobs/remote-ai-driven-engineer-ruby-cloudwalk-1093571
Senior Security Engineer,Immutable,Australia,"security, saas, web3, crypto, ethereum, game, gaming, technical, support, growth, leader, strategy, lead, senior, operations, health, engineer, recruitment",https://remoteOK.com/remote-jobs/remote-senior-security-engineer-immutable-1093568
Software Engineer,Loancrate,,"senior, full stack, javascript, typescript, react, node, postgres, aws, tailwind, remote, startup",https://remoteOK.com/remote-jobs/remote-software-engineer-loancrate-1093565
US Rater,TELUS Digital,,"social media, media, advertisement, feedback, seo, online",https://remoteOK.com/remote-jobs/remote-us-rater-telus-digital-1093564
