Position,Company,Location,Tags,URL
DevOps Engineer,InfStones,Texas,"amazon, web3, system, security, support, software, testing, test, code, qa, devops, serverless, cloud, git, node, administrator, management, reliability, engineer, linux, full-time",https://remoteOK.com/remote-jobs/remote-devops-engineer-infstones-1093766
Chargeback Analyst,CloudWalk,São Paulo,"analyst, teach, support, code, fintech, operations, operational, engineering",https://remoteOK.com/remote-jobs/remote-chargeback-analyst-cloudwalk-1093746
Senior Software Engineer Backend,Allocate,California,"software, design, c#, docker, technical, support, developer, code, web, fintech, git, api, strategy, senior, engineer, engineering, backend, digital nomad",https://remoteOK.com/remote-jobs/remote-senior-software-engineer-backend-allocate-1093713
Senior Front End Engineer,AscendEX,,"design, cryptocurrency, front-end, back-end, software, growth, code, web, financial, management, senior, junior, engineer, engineering, digital nomad",https://remoteOK.com/remote-jobs/remote-senior-front-end-engineer-ascendex-1093703
Full Stack Engineer,Sensor Tower,Istanbul,"jira, c#, developer, code, bank, analytics, health, engineer, recruitment, linux, full-time, digital nomad",https://remoteOK.com/remote-jobs/remote-full-stack-engineer-sensor-tower-1093661
Senior Software Engineer,Proof,"Remote, Boston, MA Preferred","software, design, front-end, back-end, security, technical, support, growth, code, web, manager, cloud, ruby, rails, management, lead, senior, legal, go, engineer, engineering, digital nomad",https://remoteOK.com/remote-jobs/remote-senior-software-engineer-proof-1093658
Developer Relations Engineer,MachineFi Lab,US Remote,"developer, design, web3, crypto, cryptocurrency, technical, growth, code, travel, api, leader, marketing, engineer, engineering, digital nomad",https://remoteOK.com/remote-jobs/remote-developer-relations-engineer-machinefi-lab-1093641
Senior Security Engineer,Loft Orbital Solutions,,"security, design, software, growth, code, financial, senior, operations, health, healthcare, engineer, engineering, digital nomad",https://remoteOK.com/remote-jobs/remote-senior-security-engineer-loft-orbital-solutions-1093625
Senior Mobile iOS Engineer,Yassir,,"ios, design, redis, frontend, back-end, technical, code, web, financial, fintech, cloud, mobile, senior, go, engineer, engineering, digital nomad",https://remoteOK.com/remote-jobs/remote-senior-mobile-ios-engineer-yassir-1093598
Member of Technical Staff Transparency,Anchorage Digital,United States,"design, crypto, front-end, back-end, security, technical, support, software, test, growth, code, financial, finance, bank, legal, engineering, digital nomad",https://remoteOK.com/remote-jobs/remote-member-of-technical-staff-transparency-anchorage-digital-1093596
AI Driven Engineer Ruby,CloudWalk,São Paulo,"technical, software, test, growth, code, financial, fintech, banking, bank, ruby, rails, management, marketing, engineer, engineering, backend",https://remoteOK.com/remote-jobs/remote-ai-driven-engineer-ruby-cloudwalk-1093571
